Output for: tcpdump -c 5 -i eth0

tcpdump -c 5 -i eth0
tcpdump: verbose output suppressed, use -v or -vv for full protocol decode
listening on eth0, link-type EN10MB (Ethernet), capture size 262144 bytes
16:42:44.090140 IP comp3133Droplet1.ssh > 198.96.84.204.48758: Flags [P.], seq 2246417694:2246417802, ack 2235175719, win 350, options [nop,nop,TS val 486889129 ecr 812497432], length 108
16:42:44.090272 IP comp3133Droplet1.ssh > 198.96.84.204.48758: Flags [P.], seq 108:144, ack 1, win 350, options [nop,nop,TS val 486889129 ecr 812497432], length 36
16:42:44.090389 IP comp3133Droplet1.ssh > 198.96.84.204.48758: Flags [P.], seq 144:252, ack 1, win 350, options [nop,nop,TS val 486889129 ecr 812497432], length 108
16:42:44.090466 IP comp3133Droplet1.ssh > 198.96.84.204.48758: Flags [P.], seq 252:288, ack 1, win 350, options [nop,nop,TS val 486889129 ecr 812497432], length 36
16:42:44.093174 IP comp3133Droplet1.ssh > 198.96.84.204.48758: Flags [P.], seq 288:516, ack 1, win 350, options [nop,nop,TS val 486889132 ecr 812497432], length 228
5 packets captured
11 packets received by filter
1 packet dropped by kernel
